[
    {
        "imageId": "100",
        "productId": "1",
        "baseUrl": "images/products/product1_iphone6_image1",
        "defaultvalue": true
    },
    {
        "imageId": "101",
        "productId": "1",
        "baseUrl": "images/products/product1_iphone6_image2",
        "defaultvalue": false
    },
    {
        "imageId": "102",
        "productId": "1",
        "baseUrl": "images/products/product1_iphone6_image3",
        "defaultvalue": false
    }
]
